"ano";"categoria";"cnae_subclasse";"is_total";"periodo_metodologico";"frequencia"
2011;"SUPERVISORES EM SERVICOS DE REPARACAO E MANUTENCAO DE MAQUINAS E EQUIPAMENTOS INDUSTRIAIS, COMERCIAIS E RESIDENCIAIS";"2452";FALSE;"2006-2021";53
2011;"SUPERVISORES NA FABRICACAO DE MATERIAIS PARA CONSTRUCAO (VIDROS E CERAMICAS)";"2452";FALSE;"2006-2021";1
2011;"TECNICOS DE APOIO EM PESQUISA E DESENVOLVIMENTO";"2452";FALSE;"2006-2021";1
2011;"TECNICOS DE CONTROLE DA PRODUCAO";"2452";FALSE;"2006-2021";1049
2011;"TECNICOS DE LABORATORIO INDUSTRIAL";"2452";FALSE;"2006-2021";61
2011;"TECNICOS DE PLANEJAMENTO E CONTROLE DE PRODUCAO";"2452";FALSE;"2006-2021";284
2011;"TECNICOS DE VENDAS ESPECIALIZADAS";"2452";FALSE;"2006-2021";71
2011;"TECNICOS E AUXILIARES DE ENFERMAGEM";"2452";FALSE;"2006-2021";23
2011;"TECNICOS EM ADMINISTRACAO";"2452";FALSE;"2006-2021";4
2011;"TECNICOS EM CALIBRACAO E INSTRUMENTACAO";"2452";FALSE;"2006-2021";5
2011;"TECNICOS EM CONSTRUCAO CIVIL (EDIFICACOES)";"2452";FALSE;"2006-2021";1
2011;"TECNICOS EM CONTABILIDADE";"2452";FALSE;"2006-2021";5
2011;"TECNICOS EM CONTROLE AMBIENTAL, UTILIDADES E TRATAMENTO DE EFLUENTES";"2452";FALSE;"2006-2021";5
2011;"TECNICOS EM ELETRICIDADE E ELETROTECNICOS (COVALIDACAO 3131)";"2452";FALSE;"2006-2021";47
2011;"TECNICOS EM ELETROMECANICA";"2452";FALSE;"2006-2021";2
2011;"TECNICOS EM ELETRONICA";"2452";FALSE;"2006-2021";94
2011;"TECNICOS EM EQUIPAMENTOS MEDICOS E ODONTOLOGICOS";"2452";FALSE;"2006-2021";7
2011;"TECNICOS EM EXPORTACAO E IMPORTACAO";"2452";FALSE;"2006-2021";2
2011;"TECNICOS EM MECATRONICA";"2452";FALSE;"2006-2021";13
2011;"TECNICOS EM METALURGIA (ESTRUTURAS METALICAS)";"2452";FALSE;"2006-2021";63
2011;"TECNICOS EM OPERACAO DE APARELHOS DE CENOGRAF";"2452";FALSE;"2006-2021";6
2011;"TECNICOS EM OPERACAO DE APARELHOS DE SONORIZACAO";"2452";FALSE;"2006-2021";1
2011;"TECNICOS EM OPERACAO E MONITORACAO DE COMPUTADORES";"2452";FALSE;"2006-2021";10
2011;"TECNICOS EM PROGRAMACAO";"2452";FALSE;"2006-2021";27
2011;"TECNICOS EM SECRETARIADO, TAQUIGRAFOS E ESTENOTIPISTAS";"2452";FALSE;"2006-2021";12
2011;"TECNICOS EM SEGURANCA NO TRABALHO";"2452";FALSE;"2006-2021";72
2011;"TECNICOS EM SIDERURGIA";"2452";FALSE;"2006-2021";48
2011;"TECNICOS EM TRANSPORTES INTERMODAIS";"2452";FALSE;"2006-2021";13
2011;"TECNICOS EM TRANSPORTES RODOVIARIOS";"2452";FALSE;"2006-2021";6
2011;"TECNICOS MECANICOS (FERRAMENTAS)";"2452";FALSE;"2006-2021";83
2011;"TECNICOS MECANICOS NA FABRICACAO E MONTAGEM DE MAQUINAS, SISTEMAS E INSTRUMENTOS";"2452";FALSE;"2006-2021";69
2011;"TECNICOS MECANICOS NA MANUTENCAO DE MAQUINAS, SISTEMAS E INSTRUMENTOS";"2452";FALSE;"2006-2021";11
2011;"TECNICOS QUIMICOS";"2452";FALSE;"2006-2021";17
2011;"TELEFONISTAS";"2452";FALSE;"2006-2021";7
2011;"TINTUREIROS, LAVADEIROS E AFINS, À MAQUINA";"2452";FALSE;"2006-2021";13
2011;"TRABALHADORES DA EXTRACAO DE MINERAIS SOLIDOS";"2452";FALSE;"2006-2021";1
2011;"TRABALHADORES DA IMPRESSAO GRAFICA";"2452";FALSE;"2006-2021";3
2011;"TRABALHADORES DA MECANIZACAO AGROPECUARIA";"2452";FALSE;"2006-2021";2
2011;"TRABALHADORES DA PINTURA DE EQUIPAMENTOS, VEICULOS, ESTRUTURAS METALICAS E DE COMPOSITOS";"2452";FALSE;"2006-2021";59
2011;"TRABALHADORES DA PRE-IMPRESSAO GRAFICA";"2452";FALSE;"2006-2021";11
2011;"TRABALHADORES DA PREPARACAO DA CONFECCAO DE CALCADOS";"2452";FALSE;"2006-2021";12
2011;"TRABALHADORES DA PREPARACAO DA CONFECCAO DE ROUPAS";"2452";FALSE;"2006-2021";11
2011;"TRABALHADORES DA TRANSFORMACAO DE VIDROS PLANOS";"2452";FALSE;"2006-2021";2
2011;"TRABALHADORES DE ACABAMENTO, TINGIMENTO E ESTAMPARIA DAS INDUSTRIAS TEXTEIS";"2452";FALSE;"2006-2021";2
2011;"TRABALHADORES DE APOIO À AGRICULTURA";"2452";FALSE;"2006-2021";11
2011;"TRABALHADORES DE BENEFICIAMENTO DE MINERIOS";"2452";FALSE;"2006-2021";0
2011;"TRABALHADORES DE BENEFICIAMENTO DE PEDRAS ORNAMENTAIS";"2452";FALSE;"2006-2021";15
2011;"TRABALHADORES DE CALDEIRARIA E SERRALHERIA";"2452";FALSE;"2006-2021";163
2011;"TRABALHADORES DE CARGAS E DESCARGAS DE MERCADORIAS";"2452";FALSE;"2006-2021";48
2011;"TRABALHADORES DE EMBALAGEM E DE ETIQUETAGEM";"2452";FALSE;"2006-2021";113
2011;"TRABALHADORES DE ESTRUTURAS DE ALVENARIA";"2452";FALSE;"2006-2021";70
2011;"TRABALHADORES DE EXTRACAO DE MINERAIS SOLIDOS (OPERADORES DE MAQUINAS)";"2452";FALSE;"2006-2021";20
2011;"TRABALHADORES DE FORJAMENTO DE METAIS";"2452";FALSE;"2006-2021";34
2011;"TRABALHADORES DE FUNDICAO DE METAIS PUROS E DE LIGAS METALICAS";"2452";FALSE;"2006-2021";3292
2011;"TRABALHADORES DE INSTALACOES DE MATERIAIS ISOLANTES";"2452";FALSE;"2006-2021";14
2011;"TRABALHADORES DE INSTALACOES ELETRICAS";"2452";FALSE;"2006-2021";52
2011;"TRABALHADORES DE MANUTENCAO DE ROCADEIRAS, MOTOSERRAS E SIMILARES";"2452";FALSE;"2006-2021";3
2011;"TRABALHADORES DE MOLDAGEM DE METAIS E DE LIGAS METALICAS";"2452";FALSE;"2006-2021";999
2011;"TRABALHADORES DE MONTAGEM DE ESTRUTURAS DE MADEIRA, METAL E COMPOSITOS EM OBRAS CIVIS";"2452";FALSE;"2006-2021";5
2011;"TRABALHADORES DE SOLDAGEM E CORTE DE METAIS E DE COMPOSITOS";"2452";FALSE;"2006-2021";286
2011;"TRABALHADORES DE TRACAGEM E MONTAGEM DE ESTRUTURAS METALICAS E DE COMPOSITOS";"2452";FALSE;"2006-2021";107
2011;"TRABALHADORES DE TRATAMENTO DE SUPERFICIES DE METAIS E DE COMPOSITOS (TERMOQUIMICOS)";"2452";FALSE;"2006-2021";65
2011;"TRABALHADORES DE TRATAMENTO TERMICO DE METAIS E DE COMPOSITOS";"2452";FALSE;"2006-2021";23
2011;"TRABALHADORES DE TREFILACAO, ESTIRAMENTO E EXTRUSAO DE METAIS E DE COMPOSITOS";"2452";FALSE;"2006-2021";18
2011;"TRABALHADORES DO ACABAMENTO GRAFICO";"2452";FALSE;"2006-2021";13
2011;"TRABALHADORES DOS SERVICOS DOMESTICOS EM GERAL";"2452";FALSE;"2006-2021";14
2011;"TRABALHADORES ELEMENTARES DE SERVICOS DE MANUTENCAO VEICULAR";"2452";FALSE;"2006-2021";1
2011;"TRABALHADORES NA FABRICACAO E CONSERVACAO DE ALIMENTOS";"2452";FALSE;"2006-2021";12
2011;"TRABALHADORES NA OPERACAO DE MAQUINAS DE TERRAPLENAGEM E FUNDACOES";"2452";FALSE;"2006-2021";9
2011;"TRABALHADORES NOS  SERVICOS DE MANUTENCAO DE EDIFICACOES";"2452";FALSE;"2006-2021";141
2011;"TRABALHADORES NOS SERVICOS DE ADMINISTRACAO DE EDIFICIOS";"2452";FALSE;"2006-2021";23
2011;"TRABALHADORES NOS SERVICOS DE MANUTENCAO E CONSERVACAO DE EDIFICIOS E LOGRADOUROS";"2452";FALSE;"2006-2021";40
2011;"TRABALHADORES OPERACIONAIS DE CONSERVACAO DE VIAS PERMANENTES (EXCETO TRILHOS)";"2452";FALSE;"2006-2021";18
2011;"TRABALHADORES POLIVALENTES DA CONFECCAO DE CALCADOS";"2452";FALSE;"2006-2021";2
2011;"TRABALHADORES POLIVALENTES DAS INDUSTRIAS DA CONFECCAO DE ROUPAS";"2452";FALSE;"2006-2021";3
2011;"Total";"2452";TRUE;"2006-2021";21538
2011;"VENDEDORES E DEMONSTRADORES EM LOJAS OU MERCADOS";"2452";FALSE;"2006-2021";136
2011;"VENDEDORES EM DOMICILIO";"2452";FALSE;"2006-2021";5
2011;"VIDREIROS E CERAMISTAS (ARTE E DECORACAO)";"2452";FALSE;"2006-2021";1
2011;"VIGILANTES E GUARDAS DE SEGURANCA";"2452";FALSE;"2006-2021";19
2011;"{ñ class}";"2452";FALSE;"2006-2021";0
2012;"ADMINISTRADORES DE EMPRESAS";"2452";FALSE;"2006-2021";28
2012;"ADVOGADOS";"2452";FALSE;"2006-2021";6
2012;"AFIADORES E POLIDORES DE METAIS";"2452";FALSE;"2006-2021";322
2012;"AGENTES DA SAUDE E DO MEIO AMBIENTE";"2452";FALSE;"2006-2021";4
2012;"AGENTES DE INSPECAO DE PESOS E MEDIDAS";"2452";FALSE;"2006-2021";42
2012;"AJUDANTES DE OBRAS CIVIS";"2452";FALSE;"2006-2021";44
2012;"AJUSTADORES MECANICOS POLIVALENTES";"2452";FALSE;"2006-2021";162
2012;"ALIMENTADORES DE LINHAS DE PRODUCAO";"2452";FALSE;"2006-2021";2862
2012;"ALMOXARIFES E ARMAZENISTAS";"2452";FALSE;"2006-2021";321
2012;"ANALISTAS DE SISTEMAS COMPUTACIONAIS";"2452";FALSE;"2006-2021";46
2012;"ARTESAOS DE METAIS PRECIOSOS E SEMI-PRECIOSOS";"2452";FALSE;"2006-2021";36
2012;"AUDITORES FISCAIS DO TRABALHO";"2452";FALSE;"2006-2021";0
2012;"AUXILIARES DE LABORATORIO DA SAUDE";"2452";FALSE;"2006-2021";6
2012;"BOMBEIROS E SALVA-VIDAS";"2452";FALSE;"2006-2021";0
2012;"CAIXAS E BILHETEIROS (EXCETO CAIXA DE BANCO)";"2452";FALSE;"2006-2021";1
2012;"CARVOEJADORES E AFINS";"2452";FALSE;"2006-2021";0
2012;"CATADORES DE SUCATA";"2452";FALSE;"2006-2021";72
2012;"CERAMISTAS (PREPARACAO E FABRICACAO)";"2452";FALSE;"2006-2021";1
2012;"COBRADORES E AFINS";"2452";FALSE;"2006-2021";1
2012;"COLORISTAS";"2452";FALSE;"2006-2021";8
2012;"COMPRADORES";"2452";FALSE;"2006-2021";61
2012;"CONFECCIONADORES DE ARTEFATOS DE MADEIRA, MOVEIS DE VIME E AFINS";"2452";FALSE;"2006-2021";4
2012;"CONSERVADORES DE VIAS PERMANENTES (TRILHOS)";"2452";FALSE;"2006-2021";3
2012;"CONTADORES E AUDITORES";"2452";FALSE;"2006-2021";77
2012;"CONTINUOS";"2452";FALSE;"2006-2021";25
2012;"COZINHEIROS";"2452";FALSE;"2006-2021";44
2012;"DESENHISTAS INDUSTRIAIS (DESIGNERS) , ESCULTORES, PINTORES E AFINS";"2452";FALSE;"2006-2021";11
2012;"DESENHISTAS PROJETISTAS DA MECANICA";"2452";FALSE;"2006-2021";58
2012;"DESENHISTAS TECNICOS DA MECANICA";"2452";FALSE;"2006-2021";7
2012;"DESENHISTAS TECNICOS DE PRODUTOS E SERVICOS DIVERSOS";"2452";FALSE;"2006-2021";4
2012;"DESENHISTAS TECNICOS, EM GERAL";"2452";FALSE;"2006-2021";9
2012;"DIRETORES ADMINISTRATIVOS E FINANCEIROS";"2452";FALSE;"2006-2021";7
2012;"DIRETORES DE MARKETING, COMERCIALIZACAO E VENDAS";"2452";FALSE;"2006-2021";2
2012;"DIRETORES DE PRODUCAO E OPERACOES EM EMPRESA DA INDUSTRIA EXTRATIVA, TRANSFORMACAO E DE SERVICOS DE UTILIDADE PUBLICA";"2452";FALSE;"2006-2021";5
2012;"DIRETORES GERAIS";"2452";FALSE;"2006-2021";9
2012;"ELETRICISTAS-ELETRONICOS DE MANUTENCAO";"2452";FALSE;"2006-2021";82
2012;"ELETRICISTAS-ELETRONICOS DE MANUTENCAO VEICULAR (AEREA, TERRESTRE E NAVAL)";"2452";FALSE;"2006-2021";0
2012;"ENCANADORES E INSTALADORES DE TUBULACOES";"2452";FALSE;"2006-2021";7
2012;"ENFERMEIROS DE NIVEL SUPERIOR E AFINS";"2452";FALSE;"2006-2021";4
2012;"ENGENHEIROS AMBIENTAIS E AFINS";"2452";FALSE;"2006-2021";0
2012;"ENGENHEIROS CIVIS E AFINS";"2452";FALSE;"2006-2021";19
2012;"ENGENHEIROS ELETROELETRONICOS E AFINS";"2452";FALSE;"2006-2021";4
2012;"ENGENHEIROS INDUSTRIAIS, DE PRODUCAO E SEGURANCA";"2452";FALSE;"2006-2021";67
2012;"ENGENHEIROS MECANICOS";"2452";FALSE;"2006-2021";11
2012;"ENGENHEIROS METALURGISTAS E DE MATERIAIS";"2452";FALSE;"2006-2021";33
2012;"ENGENHEIROS QUIMICOS";"2452";FALSE;"2006-2021";4
2012;"ESCRITURARIOS DE APOIO À PRODUCAO";"2452";FALSE;"2006-2021";145
2012;"ESCRITURARIOS DE CONTABILIDADE";"2452";FALSE;"2006-2021";64
2012;"ESCRITURARIOS EM GERAL, AGENTES, ASSISTENTES E AUXILIARES ADMINISTRATIVOS";"2452";FALSE;"2006-2021";829
2012;"ESPECIALISTAS EM INFORMATICA";"2452";FALSE;"2006-2021";14
2012;"EXTRATIVISTAS FLORESTAIS DE ESPECIES PRODUTORAS DE MADEIRA";"2452";FALSE;"2006-2021";0
2012;"FERRAMENTEIROS E AFINS";"2452";FALSE;"2006-2021";513
2012;"FISCAIS E COBRADORES DOS TRANSPORTES PUBLICOS";"2452";FALSE;"2006-2021";1
2012;"FORNEIROS METALURGICOS (SEGUNDA FUSAO E REAQUECIMENTO)";"2452";FALSE;"2006-2021";235
2012;"GARCONS, BARMEN, COPEIROS E SOMMELIERS";"2452";FALSE;"2006-2021";36
2012;"GERENTES ADMINISTRATIVOS, FINANCEIROS E DE RISCOS";"2452";FALSE;"2006-2021";81
2012;"GERENTES DE MANUTENCAO";"2452";FALSE;"2006-2021";17
2012;"GERENTES DE MARKETING, COMERCIALIZACAO E VENDAS";"2452";FALSE;"2006-2021";48
2012;"GERENTES DE OPERACOES COMERCIAIS E DE REPARACAO";"2452";FALSE;"2006-2021";44
2012;"GERENTES DE OPERACOES DE SERVICOS EM EMPRESA DE TRANSPORTE, DE COMUNICACAO E DE LOGISTICA (ARMAZENAGEM E DISTRIBUICAO)";"2452";FALSE;"2006-2021";12
2012;"GERENTES DE PESQUISA E DESENVOLVIMENTO";"2452";FALSE;"2006-2021";13
2012;"GERENTES DE PRODUCAO E OPERACOES EM EMPRESA DA INDUSTRIA EXTRATIVA, DE TRANSFORMACAO E DE SERVICOS DE UTILIDADE PUBLICA";"2452";FALSE;"2006-2021";95
2012;"GERENTES DE RH E RELACOES DO TRABALHO";"2452";FALSE;"2006-2021";12
2012;"GERENTES DE SUPRIMENTOS E AFINS";"2452";FALSE;"2006-2021";21
2012;"GERENTES DE TECNOLOGIA DA INFORMACAO";"2452";FALSE;"2006-2021";7
2012;"INSPETORES E REVISORES DE PRODUCAO TEXTIL";"2452";FALSE;"2006-2021";0
2012;"INSTALADORES E REPARADORES DE LINHAS E CABOS ELETRICOS, TELEFONICOS E DE COMUNICACAO DE DADOS";"2452";FALSE;"2006-2021";1
2012;"INSTRUTORES DE ENSINO PROFISSIONAL";"2452";FALSE;"2006-2021";0
2012;"LABORATORISTAS INDUSTRIAIS AUXILIARES";"2452";FALSE;"2006-2021";14
2012;"LUBRIFICADORES";"2452";FALSE;"2006-2021";27
2012;"MANTENEDORES DE ELVADORES, ESCADAS E PORTAS AUTOMATICAS";"2452";FALSE;"2006-2021";3
2012;"MARCENEIROS E AFINS";"2452";FALSE;"2006-2021";16
2012;"MECANICOS DE INSTRUMENTOS DE PRECISAO (EXCETO TECNICOS)";"2452";FALSE;"2006-2021";7
2012;"MECANICOS DE MANUTENCAO DE BOMBAS, MOTORES, COMPRESSORES E EQUIPAMENTOS DE TRANSMISSAO";"2452";FALSE;"2006-2021";4
2012;"MECANICOS DE MANUTENCAO DE MAQUINAS INDUSTRIAIS";"2452";FALSE;"2006-2021";370
2012;"MECANICOS DE MANUTENCAO DE MAQUINAS PESADAS E EQUIPAMENTOS AGRICOLAS";"2452";FALSE;"2006-2021";2
2012;"MECANICOS DE MANUTENCAO DE VEICULOS AUTOMOTORES";"2452";FALSE;"2006-2021";12
2012;"MEDICOS CLINICOS";"2452";FALSE;"2006-2021";14
2012;"MONTADORES DE EQUIPAMENTOS ELETRO-ELETRONICOS";"2452";FALSE;"2006-2021";47
2012;"MONTADORES DE ESTRUTURAS DE CONCRETO ARMADO";"2452";FALSE;"2006-2021";3
2012;"MONTADORES DE MAQUINAS INDUSTRIAIS";"2452";FALSE;"2006-2021";99
2012;"MONTADORES DE MAQUINAS PESADAS E EQUIPAMENTOS AGRICOLAS";"2452";FALSE;"2006-2021";0
2012;"MONTADORES DE MAQUINAS, APARELHOS E ACESSORIOS EM LINHAS DE MONTAGEM";"2452";FALSE;"2006-2021";25
2012;"MONTADORES DE MOVEIS E ARTEFATOS DE MADEIRA";"2452";FALSE;"2006-2021";2
2012;"MOTOCICLISTAS E CICLISTAS DE ENTREGAS RAPIDAS";"2452";FALSE;"2006-2021";7
2012;"MOTORISTAS DE VEICULOS DE CARGAS EM GERAL";"2452";FALSE;"2006-2021";116
2012;"MOTORISTAS DE VEICULOS DE PEQUENO E MEDIO PORTE";"2452";FALSE;"2006-2021";92
2012;"OPERADORES DA FIACAO";"2452";FALSE;"2006-2021";6
2012;"OPERADORES DE EQUIPAMENTOS DE ACABAMENTO DE CHAPAS E METAIS";"2452";FALSE;"2006-2021";1090
2012;"OPERADORES DE EQUIPAMENTOS DE COQUEIFICACAO";"2452";FALSE;"2006-2021";21
2012;"OPERADORES DE EQUIPAMENTOS DE MOVIMENTACAO DE CARGAS";"2452";FALSE;"2006-2021";160
2012;"OPERADORES DE FILTRAGEM E SEPARACAO";"2452";FALSE;"2006-2021";11
2012;"OPERADORES DE FORNOS DE PRIMEIRA  FUSAO E ACIARIA";"2452";FALSE;"2006-2021";416
2012;"OPERADORES DE INSTALACOES DE CAPTACAO E TRATAMENTO DE ESGOTOS";"2452";FALSE;"2006-2021";11
2012;"OPERADORES DE INSTALACOES E EQUIPAMENTOS DE FABRICACAO DE CERAMICAS, VIDROS E PORCELANAS";"2452";FALSE;"2006-2021";7
2012;"OPERADORES DE INSTALACOES E EQUIPAMENTOS DE FABRICACAO DE MATERIAIS DE CONSTRUCAO";"2452";FALSE;"2006-2021";12
2012;"OPERADORES DE INSTALACOES E MAQUINAS DE PRODUTOS PLASTICOS, DE BORRACHA E PARAFINAS";"2452";FALSE;"2006-2021";31
2012;"OPERADORES DE LAMINACAO";"2452";FALSE;"2006-2021";114
2012;"OPERADORES DE MAQUINAS A VAPOR E UTILIDADES";"2452";FALSE;"2006-2021";102
2012;"OPERADORES DE MAQUINAS DE CONFORMACAO DE METAIS";"2452";FALSE;"2006-2021";128
2012;"OPERADORES DE MAQUINAS DE DESDOBRAMENTO DE MADEIRAS";"2452";FALSE;"2006-2021";10
2012;"OPERADORES DE MAQUINAS DE ESCRITORIO";"2452";FALSE;"2006-2021";3
2012;"OPERADORES DE MAQUINAS DE FABRICAR PAPEL E PAPELAO";"2452";FALSE;"2006-2021";2
2012;"OPERADORES DE MAQUINAS DE USINAGEM DE MADEIRA CNC";"2452";FALSE;"2006-2021";5
2012;"OPERADORES DE MAQUINAS E CENTROS DE USINAGEM CNC";"2452";FALSE;"2006-2021";845
2012;"OPERADORES DE MAQUINAS E EQUIPAMENTOS DE ELEVACAO";"2452";FALSE;"2006-2021";4
2012;"OPERADORES DE MOAGEM E MISTURA DE MATERIAIS (TRATAMENTOS QUIMICOS E AFINS)";"2452";FALSE;"2006-2021";3
2012;"OPERADORES DE PROCESSO TERMOQUIMICOS E AFINS";"2452";FALSE;"2006-2021";0
2012;"OPERADORES DE PROCESSOS DAS INDUSTRIAS DE TRANSFORMACAO DE PRODUTOS QUIMICOS, PETROQUIMICOS E AFINS";"2452";FALSE;"2006-2021";39
2012;"OPERADORES NA PREPARACAO DE MASSAS PARA ABRASIVO, VIDRO, CERAMICA, PORCELANA E MATERIAIS DE CONSTRUCAO";"2452";FALSE;"2006-2021";1
2012;"OUTROS TRABALHADORES DOS SERVICOS";"2452";FALSE;"2006-2021";7
2012;"Outras Ocupações";"2452";FALSE;"2006-2021";176
2012;"PESQUISADORES DE ENGENHARIA E TECNOLOGIA";"2452";FALSE;"2006-2021";13
2012;"PINTORES DE OBRAS E REVESTIDORES DE INTERIORES (REVESTIMENTOS FLEXIVEIS)";"2452";FALSE;"2006-2021";8
2012;"PORTEIROS, GUARDAS E VIGIAS";"2452";FALSE;"2006-2021";123
2012;"PREPARADORES E OPERADORES DE MAQUINAS-FERRAMENTA CONVENCIONAIS";"2452";FALSE;"2006-2021";883
2012;"PREPARADORES E OPERADORES DE USINAGEM DE MADEIRA CONVENCIONAL";"2452";FALSE;"2006-2021";28
2012;"PROFISSIONAIS DA INFORMACAO";"2452";FALSE;"2006-2021";2
2012;"PROFISSIONAIS DA METROLOGIA";"2452";FALSE;"2006-2021";4
2012;"PROFISSIONAIS DE ADMINISTRACAO ECONOMICO-FINANCEIRA";"2452";FALSE;"2006-2021";11
2012;"PROFISSIONAIS DE RECURSOS HUMANOS";"2452";FALSE;"2006-2021";55
2012;"PROFISSIONAIS DE RELACOES PUBLICAS, PUBLICIDADE, MERCADO E NEGOCIOS";"2452";FALSE;"2006-2021";17
2012;"PROFISSIONAIS EM PESQUISA E ANALISE ECONOMICAS";"2452";FALSE;"2006-2021";15
2012;"QUIMICOS";"2452";FALSE;"2006-2021";7
2012;"RECEPCIONISTAS";"2452";FALSE;"2006-2021";59
2012;"SECRETARIOS EXECUTIVOS E BILINGUES";"2452";FALSE;"2006-2021";46
2012;"SOPRADORES, MOLDADORES E MODELADORES DE VIDROS E AFINS";"2452";FALSE;"2006-2021";2
2012;"SUPERVISORES DA CONSTRUCAO CIVIL";"2452";FALSE;"2006-2021";9
2012;"SUPERVISORES DA EXTRACAO MINERAL";"2452";FALSE;"2006-2021";0
2012;"SUPERVISORES DA INDUSTRIA TEXTIL";"2452";FALSE;"2006-2021";3
2012;"SUPERVISORES DA MECANICA DE PRECISAO E INSTRUMENTOS MUSICAIS";"2452";FALSE;"2006-2021";1
2012;"SUPERVISORES DA MONTAGEM METALMECANICA";"2452";FALSE;"2006-2021";14
2012;"SUPERVISORES DA PRODUCAO DE UTILIDADES";"2452";FALSE;"2006-2021";5
2012;"SUPERVISORES DAS ARTES GRAFICAS";"2452";FALSE;"2006-2021";1
2012;"SUPERVISORES DE MANUTENCAO ELETRO-ELETRONICA INDUSTRIAL, COMERCIAL E RESIDENCIAL";"2452";FALSE;"2006-2021";4
2012;"SUPERVISORES DE MANUTENCAO ELETROMECANICA";"2452";FALSE;"2006-2021";7
2012;"SUPERVISORES DE MONTAGENS E INSTALACOES ELETROELETRONICAS";"2452";FALSE;"2006-2021";8
2012;"SUPERVISORES DE PRODUCAO EM INDUSTRIAS SIDERURGICAS";"2452";FALSE;"2006-2021";9
2012;"SUPERVISORES DE SERVICOS ADMINISTRATIVOS (EXCETO CONTABILIDADE, FINANCAS E CONTROLE)";"2452";FALSE;"2006-2021";64
2012;"SUPERVISORES DE SERVICOS FINANCEIROS, DE CAMBIO E DE CONTROLE";"2452";FALSE;"2006-2021";33
2012;"SUPERVISORES DE TRABALHADORES DE ATENDIMENTO AO PUBLICO";"2452";FALSE;"2006-2021";3
2012;"SUPERVISORES DE TRABALHADORES DE EMBALAGEM E ETIQUETAGEM";"2452";FALSE;"2006-2021";3
2012;"SUPERVISORES DE USINAGEM, CONFORMACAO E TRATAMENTO DE METAIS";"2452";FALSE;"2006-2021";260
2012;"SUPERVISORES DE VENDAS E DE PRESTACAO DE SERVICOS";"2452";FALSE;"2006-2021";12
2012;"SUPERVISORES DE VIDRARIA, CERAMICA E AFINS";"2452";FALSE;"2006-2021";1
2012;"SUPERVISORES DOS SERVICOS DE PROTECAO, SEGURANCA E OUTROS";"2452";FALSE;"2006-2021";12
2012;"SUPERVISORES EM SERVICOS DE REPARACAO E MANUTENCAO DE MAQUINAS E EQUIPAMENTOS INDUSTRIAIS, COMERCIAIS E RESIDENCIAIS";"2452";FALSE;"2006-2021";53
2012;"SUPERVISORES NA FABRICACAO DE MATERIAIS PARA CONSTRUCAO (VIDROS E CERAMICAS)";"2452";FALSE;"2006-2021";1
2012;"TECNICOS DE APOIO EM PESQUISA E DESENVOLVIMENTO";"2452";FALSE;"2006-2021";2
2012;"TECNICOS DE CONTROLE DA PRODUCAO";"2452";FALSE;"2006-2021";946
2012;"TECNICOS DE LABORATORIO INDUSTRIAL";"2452";FALSE;"2006-2021";55
2012;"TECNICOS DE PLANEJAMENTO E CONTROLE DE PRODUCAO";"2452";FALSE;"2006-2021";221
2012;"TECNICOS DE VENDAS ESPECIALIZADAS";"2452";FALSE;"2006-2021";78
2012;"TECNICOS E AUXILIARES DE ENFERMAGEM";"2452";FALSE;"2006-2021";17
2012;"TECNICOS EM ADMINISTRACAO";"2452";FALSE;"2006-2021";6
2012;"TECNICOS EM CALIBRACAO E INSTRUMENTACAO";"2452";FALSE;"2006-2021";6
2012;"TECNICOS EM CONSTRUCAO CIVIL (EDIFICACOES)";"2452";FALSE;"2006-2021";2
2012;"TECNICOS EM CONTABILIDADE";"2452";FALSE;"2006-2021";4
2012;"TECNICOS EM CONTROLE AMBIENTAL, UTILIDADES E TRATAMENTO DE EFLUENTES";"2452";FALSE;"2006-2021";3
2012;"TECNICOS EM ELETRICIDADE E ELETROTECNICOS (COVALIDACAO 3131)";"2452";FALSE;"2006-2021";37
2012;"TECNICOS EM ELETROMECANICA";"2452";FALSE;"2006-2021";2
2012;"TECNICOS EM ELETRONICA";"2452";FALSE;"2006-2021";100
2012;"TECNICOS EM EQUIPAMENTOS MEDICOS E ODONTOLOGICOS";"2452";FALSE;"2006-2021";5
2012;"TECNICOS EM EXPORTACAO E IMPORTACAO";"2452";FALSE;"2006-2021";3
2012;"TECNICOS EM MECATRONICA";"2452";FALSE;"2006-2021";15
2012;"TECNICOS EM METALURGIA (ESTRUTURAS METALICAS)";"2452";FALSE;"2006-2021";61
2012;"TECNICOS EM OPERACAO DE APARELHOS DE CENOGRAF";"2452";FALSE;"2006-2021";15
2012;"TECNICOS EM OPERACAO DE APARELHOS DE SONORIZACAO";"2452";FALSE;"2006-2021";8
2012;"TECNICOS EM OPERACAO E MONITORACAO DE COMPUTADORES";"2452";FALSE;"2006-2021";8
2012;"TECNICOS EM PROGRAMACAO";"2452";FALSE;"2006-2021";26
2012;"TECNICOS EM SECRETARIADO, TAQUIGRAFOS E ESTENOTIPISTAS";"2452";FALSE;"2006-2021";9
2012;"TECNICOS EM SEGURANCA NO TRABALHO";"2452";FALSE;"2006-2021";71
2012;"TECNICOS EM SIDERURGIA";"2452";FALSE;"2006-2021";35
2012;"TECNICOS EM TRANSPORTES INTERMODAIS";"2452";FALSE;"2006-2021";15
2012;"TECNICOS EM TRANSPORTES RODOVIARIOS";"2452";FALSE;"2006-2021";4
2012;"TECNICOS MECANICOS (FERRAMENTAS)";"2452";FALSE;"2006-2021";87
2012;"TECNICOS MECANICOS NA FABRICACAO E MONTAGEM DE MAQUINAS, SISTEMAS E INSTRUMENTOS";"2452";FALSE;"2006-2021";77
2012;"TECNICOS MECANICOS NA MANUTENCAO DE MAQUINAS, SISTEMAS E INSTRUMENTOS";"2452";FALSE;"2006-2021";2
2012;"TECNICOS QUIMICOS";"2452";FALSE;"2006-2021";19
2012;"TELEFONISTAS";"2452";FALSE;"2006-2021";5
2012;"TINTUREIROS, LAVADEIROS E AFINS, À MAQUINA";"2452";FALSE;"2006-2021";23
2012;"TRABALHADORES AUXILIARES NOS SERVICOS DE ALIMENTACAO";"2452";FALSE;"2006-2021";0
2012;"TRABALHADORES DA EXTRACAO DE MINERAIS SOLIDOS";"2452";FALSE;"2006-2021";2
2012;"TRABALHADORES DA IMPRESSAO GRAFICA";"2452";FALSE;"2006-2021";5
2012;"TRABALHADORES DA MECANIZACAO AGROPECUARIA";"2452";FALSE;"2006-2021";2
2012;"TRABALHADORES DA PINTURA DE EQUIPAMENTOS, VEICULOS, ESTRUTURAS METALICAS E DE COMPOSITOS";"2452";FALSE;"2006-2021";61
2012;"TRABALHADORES DA PRE-IMPRESSAO GRAFICA";"2452";FALSE;"2006-2021";17
2012;"TRABALHADORES DA PREPARACAO DA CONFECCAO DE CALCADOS";"2452";FALSE;"2006-2021";12
2012;"TRABALHADORES DA PREPARACAO DA CONFECCAO DE ROUPAS";"2452";FALSE;"2006-2021";8
2012;"TRABALHADORES DA TRANSFORMACAO DE VIDROS PLANOS";"2452";FALSE;"2006-2021";4
2012;"TRABALHADORES DE ACABAMENTO, TINGIMENTO E ESTAMPARIA DAS INDUSTRIAS TEXTEIS";"2452";FALSE;"2006-2021";2
2012;"TRABALHADORES DE APOIO À AGRICULTURA";"2452";FALSE;"2006-2021";15
2012;"TRABALHADORES DE BENEFICIAMENTO DE MINERIOS";"2452";FALSE;"2006-2021";1
2012;"TRABALHADORES DE BENEFICIAMENTO DE PEDRAS ORNAMENTAIS";"2452";FALSE;"2006-2021";6
2012;"TRABALHADORES DE CALDEIRARIA E SERRALHERIA";"2452";FALSE;"2006-2021";193
2012;"TRABALHADORES DE CARGAS E DESCARGAS DE MERCADORIAS";"2452";FALSE;"2006-2021";47
2012;"TRABALHADORES DE EMBALAGEM E DE ETIQUETAGEM";"2452";FALSE;"2006-2021";129
2012;"TRABALHADORES DE ESTRUTURAS DE ALVENARIA";"2452";FALSE;"2006-2021";81
2012;"TRABALHADORES DE EXTRACAO DE MINERAIS SOLIDOS (OPERADORES DE MAQUINAS)";"2452";FALSE;"2006-2021";21
2012;"TRABALHADORES DE FORJAMENTO DE METAIS";"2452";FALSE;"2006-2021";21
2012;"TRABALHADORES DE FUNDICAO DE METAIS PUROS E DE LIGAS METALICAS";"2452";FALSE;"2006-2021";2481
2012;"TRABALHADORES DE INSTALACOES DE MATERIAIS ISOLANTES";"2452";FALSE;"2006-2021";11
2012;"TRABALHADORES DE INSTALACOES ELETRICAS";"2452";FALSE;"2006-2021";53
2012;"TRABALHADORES DE MANUTENCAO DE ROCADEIRAS, MOTOSERRAS E SIMILARES";"2452";FALSE;"2006-2021";1
2012;"TRABALHADORES DE MOLDAGEM DE METAIS E DE LIGAS METALICAS";"2452";FALSE;"2006-2021";973
2012;"TRABALHADORES DE MONTAGEM DE ESTRUTURAS DE MADEIRA, METAL E COMPOSITOS EM OBRAS CIVIS";"2452";FALSE;"2006-2021";7
2012;"TRABALHADORES DE SOLDAGEM E CORTE DE METAIS E DE COMPOSITOS";"2452";FALSE;"2006-2021";298
2012;"TRABALHADORES DE TRACAGEM E MONTAGEM DE ESTRUTURAS METALICAS E DE COMPOSITOS";"2452";FALSE;"2006-2021";108
2012;"TRABALHADORES DE TRATAMENTO DE SUPERFICIES DE METAIS E DE COMPOSITOS (TERMOQUIMICOS)";"2452";FALSE;"2006-2021";78
2012;"TRABALHADORES DE TRATAMENTO TERMICO DE METAIS E DE COMPOSITOS";"2452";FALSE;"2006-2021";13
2012;"TRABALHADORES DE TREFILACAO, ESTIRAMENTO E EXTRUSAO DE METAIS E DE COMPOSITOS";"2452";FALSE;"2006-2021";16
2012;"TRABALHADORES DO ACABAMENTO GRAFICO";"2452";FALSE;"2006-2021";14
2012;"TRABALHADORES ELEMENTARES DE SERVICOS DE MANUTENCAO VEICULAR";"2452";FALSE;"2006-2021";1
2012;"TRABALHADORES NA FABRICACAO E CONSERVACAO DE ALIMENTOS";"2452";FALSE;"2006-2021";12
2012;"TRABALHADORES NA OPERACAO DE MAQUINAS DE TERRAPLENAGEM E FUNDACOES";"2452";FALSE;"2006-2021";6
2012;"TRABALHADORES NOS  SERVICOS DE MANUTENCAO DE EDIFICACOES";"2452";FALSE;"2006-2021";138
2012;"TRABALHADORES NOS SERVICOS DE ADMINISTRACAO DE EDIFICIOS";"2452";FALSE;"2006-2021";19
2012;"TRABALHADORES NOS SERVICOS DE MANUTENCAO E CONSERVACAO DE EDIFICIOS E LOGRADOUROS";"2452";FALSE;"2006-2021";41
2012;"TRABALHADORES OPERACIONAIS DE CONSERVACAO DE VIAS PERMANENTES (EXCETO TRILHOS)";"2452";FALSE;"2006-2021";41
2012;"TRABALHADORES POLIVALENTES DA CONFECCAO DE CALCADOS";"2452";FALSE;"2006-2021";2
2012;"TRABALHADORES POLIVALENTES DAS INDUSTRIAS DA CONFECCAO DE ROUPAS";"2452";FALSE;"2006-2021";1
2012;"Total";"2452";TRUE;"2006-2021";19619
2012;"VENDEDORES E DEMONSTRADORES EM LOJAS OU MERCADOS";"2452";FALSE;"2006-2021";138
2012;"VENDEDORES EM DOMICILIO";"2452";FALSE;"2006-2021";7
2012;"VIDREIROS E CERAMISTAS (ARTE E DECORACAO)";"2452";FALSE;"2006-2021";1
2012;"VIGILANTES E GUARDAS DE SEGURANCA";"2452";FALSE;"2006-2021";16
2012;"{ñ class}";"2452";FALSE;"2006-2021";2
2013;"ADMINISTRADORES DE EMPRESAS";"2452";FALSE;"2006-2021";19
2013;"ADVOGADOS";"2452";FALSE;"2006-2021";1
2013;"AFIADORES E POLIDORES DE METAIS";"2452";FALSE;"2006-2021";334
2013;"AGENTES DA SAUDE E DO MEIO AMBIENTE";"2452";FALSE;"2006-2021";2
2013;"AGENTES DE INSPECAO DE PESOS E MEDIDAS";"2452";FALSE;"2006-2021";30
2013;"AJUDANTES DE OBRAS CIVIS";"2452";FALSE;"2006-2021";63
2013;"AJUSTADORES MECANICOS POLIVALENTES";"2452";FALSE;"2006-2021";110
2013;"ALIMENTADORES DE LINHAS DE PRODUCAO";"2452";FALSE;"2006-2021";2585
2013;"ALMOXARIFES E ARMAZENISTAS";"2452";FALSE;"2006-2021";319
2013;"ANALISTAS DE SISTEMAS COMPUTACIONAIS";"2452";FALSE;"2006-2021";47
