"ano";"categoria";"cnae_subclasse";"is_total";"periodo_metodologico";"frequencia"
2020;"COZINHEIROS";"2452";FALSE;"2006-2021";15
2020;"DESENHISTAS INDUSTRIAIS (DESIGNERS) , ESCULTORES, PINTORES E AFINS";"2452";FALSE;"2006-2021";7
2020;"DESENHISTAS PROJETISTAS DA MECANICA";"2452";FALSE;"2006-2021";29
2020;"DESENHISTAS TECNICOS DA MECANICA";"2452";FALSE;"2006-2021";3
2020;"DESENHISTAS TECNICOS DE PRODUTOS E SERVICOS DIVERSOS";"2452";FALSE;"2006-2021";6
2020;"DESENHISTAS TECNICOS, EM GERAL";"2452";FALSE;"2006-2021";3
2020;"DIRETORES ADMINISTRATIVOS E FINANCEIROS";"2452";FALSE;"2006-2021";5
2020;"DIRETORES DE MARKETING, COMERCIALIZACAO E VENDAS";"2452";FALSE;"2006-2021";2
2020;"DIRETORES DE PRODUCAO E OPERACOES EM EMPRESA DA INDUSTRIA EXTRATIVA, TRANSFORMACAO E DE SERVICOS DE UTILIDADE PUBLICA";"2452";FALSE;"2006-2021";1
2020;"DIRETORES GERAIS";"2452";FALSE;"2006-2021";5
2020;"ELETRICISTAS-ELETRONICOS DE MANUTENCAO";"2452";FALSE;"2006-2021";43
2020;"ELETRICISTAS-ELETRONICOS DE MANUTENCAO VEICULAR (AEREA, TERRESTRE E NAVAL)";"2452";FALSE;"2006-2021";3
2020;"ENCANADORES E INSTALADORES DE TUBULACOES";"2452";FALSE;"2006-2021";0
2020;"ENFERMEIROS DE NIVEL SUPERIOR E AFINS";"2452";FALSE;"2006-2021";0
2020;"ENGENHEIROS AMBIENTAIS E AFINS";"2452";FALSE;"2006-2021";2
2020;"ENGENHEIROS CIVIS E AFINS";"2452";FALSE;"2006-2021";2
2020;"ENGENHEIROS ELETROELETRONICOS E AFINS";"2452";FALSE;"2006-2021";5
2020;"ENGENHEIROS INDUSTRIAIS, DE PRODUCAO E SEGURANCA";"2452";FALSE;"2006-2021";32
2020;"ENGENHEIROS MECANICOS";"2452";FALSE;"2006-2021";5
2020;"ENGENHEIROS METALURGISTAS E DE MATERIAIS";"2452";FALSE;"2006-2021";7
2020;"ENGENHEIROS QUIMICOS";"2452";FALSE;"2006-2021";0
2020;"ESCRITURARIOS DE APOIO À PRODUCAO";"2452";FALSE;"2006-2021";106
2020;"ESCRITURARIOS DE CONTABILIDADE";"2452";FALSE;"2006-2021";61
2020;"ESCRITURARIOS EM GERAL, AGENTES, ASSISTENTES E AUXILIARES ADMINISTRATIVOS";"2452";FALSE;"2006-2021";427
2020;"ESPECIALISTAS EM INFORMATICA";"2452";FALSE;"2006-2021";3
2020;"FERRAMENTEIROS E AFINS";"2452";FALSE;"2006-2021";295
2020;"FISCAIS E COBRADORES DOS TRANSPORTES PUBLICOS";"2452";FALSE;"2006-2021";1
2020;"FORNEIROS METALURGICOS (SEGUNDA FUSAO E REAQUECIMENTO)";"2452";FALSE;"2006-2021";224
2020;"GARCONS, BARMEN, COPEIROS E SOMMELIERS";"2452";FALSE;"2006-2021";5
2020;"GERENTES ADMINISTRATIVOS, FINANCEIROS E DE RISCOS";"2452";FALSE;"2006-2021";58
2020;"GERENTES DE MANUTENCAO";"2452";FALSE;"2006-2021";11
2020;"GERENTES DE MARKETING, COMERCIALIZACAO E VENDAS";"2452";FALSE;"2006-2021";36
2020;"GERENTES DE OPERACOES COMERCIAIS E DE REPARACAO";"2452";FALSE;"2006-2021";10
2020;"GERENTES DE OPERACOES DE SERVICOS EM EMPRESA DE TRANSPORTE, DE COMUNICACAO E DE LOGISTICA (ARMAZENAGEM E DISTRIBUICAO)";"2452";FALSE;"2006-2021";10
2020;"GERENTES DE PESQUISA E DESENVOLVIMENTO";"2452";FALSE;"2006-2021";5
2020;"GERENTES DE PRODUCAO E OPERACOES EM EMPRESA DA INDUSTRIA EXTRATIVA, DE TRANSFORMACAO E DE SERVICOS DE UTILIDADE PUBLICA";"2452";FALSE;"2006-2021";72
2020;"GERENTES DE RH E RELACOES DO TRABALHO";"2452";FALSE;"2006-2021";15
2020;"GERENTES DE SUPRIMENTOS E AFINS";"2452";FALSE;"2006-2021";12
2020;"GERENTES DE TECNOLOGIA DA INFORMACAO";"2452";FALSE;"2006-2021";2
2020;"INSPETORES E REVISORES DE PRODUCAO TEXTIL";"2452";FALSE;"2006-2021";3
2020;"INSTALADORES E REPARADORES DE LINHAS E CABOS ELETRICOS, TELEFONICOS E DE COMUNICACAO DE DADOS";"2452";FALSE;"2006-2021";2
2020;"INSTRUTORES DE ENSINO PROFISSIONAL";"2452";FALSE;"2006-2021";0
2020;"LABORATORISTAS INDUSTRIAIS AUXILIARES";"2452";FALSE;"2006-2021";7
2020;"LUBRIFICADORES";"2452";FALSE;"2006-2021";6
2020;"MANTENEDORES DE ELVADORES, ESCADAS E PORTAS AUTOMATICAS";"2452";FALSE;"2006-2021";8
2020;"MARCENEIROS E AFINS";"2452";FALSE;"2006-2021";7
2020;"MECANICOS DE INSTRUMENTOS DE PRECISAO (EXCETO TECNICOS)";"2452";FALSE;"2006-2021";43
2020;"MECANICOS DE MANUTENCAO DE BOMBAS, MOTORES, COMPRESSORES E EQUIPAMENTOS DE TRANSMISSAO";"2452";FALSE;"2006-2021";0
2020;"MECANICOS DE MANUTENCAO DE MAQUINAS INDUSTRIAIS";"2452";FALSE;"2006-2021";170
2020;"MECANICOS DE MANUTENCAO DE MAQUINAS PESADAS E EQUIPAMENTOS AGRICOLAS";"2452";FALSE;"2006-2021";1
2020;"MECANICOS DE MANUTENCAO DE VEICULOS AUTOMOTORES";"2452";FALSE;"2006-2021";13
2020;"MEDICOS CLINICOS";"2452";FALSE;"2006-2021";5
2020;"MONTADORES DE EQUIPAMENTOS ELETRO-ELETRONICOS";"2452";FALSE;"2006-2021";1
2020;"MONTADORES DE ESTRUTURAS DE CONCRETO ARMADO";"2452";FALSE;"2006-2021";1
2020;"MONTADORES DE MAQUINAS INDUSTRIAIS";"2452";FALSE;"2006-2021";36
2020;"MONTADORES DE MAQUINAS PESADAS E EQUIPAMENTOS AGRICOLAS";"2452";FALSE;"2006-2021";0
2020;"MONTADORES DE MAQUINAS, APARELHOS E ACESSORIOS EM LINHAS DE MONTAGEM";"2452";FALSE;"2006-2021";11
2020;"MONTADORES DE MOVEIS E ARTEFATOS DE MADEIRA";"2452";FALSE;"2006-2021";2
2020;"MOTOCICLISTAS E CICLISTAS DE ENTREGAS RAPIDAS";"2452";FALSE;"2006-2021";3
2020;"MOTORISTAS DE VEICULOS DE CARGAS EM GERAL";"2452";FALSE;"2006-2021";88
2020;"MOTORISTAS DE VEICULOS DE PEQUENO E MEDIO PORTE";"2452";FALSE;"2006-2021";57
2020;"OPERADORES DA FIACAO";"2452";FALSE;"2006-2021";3
2020;"OPERADORES DE EQUIPAMENTOS DE ACABAMENTO DE CHAPAS E METAIS";"2452";FALSE;"2006-2021";841
2020;"OPERADORES DE EQUIPAMENTOS DE COQUEIFICACAO";"2452";FALSE;"2006-2021";18
2020;"OPERADORES DE EQUIPAMENTOS DE MOVIMENTACAO DE CARGAS";"2452";FALSE;"2006-2021";178
2020;"OPERADORES DE FILTRAGEM E SEPARACAO";"2452";FALSE;"2006-2021";13
2020;"OPERADORES DE FORNOS DE PRIMEIRA  FUSAO E ACIARIA";"2452";FALSE;"2006-2021";471
2020;"OPERADORES DE INSTALACOES DE CAPTACAO E TRATAMENTO DE ESGOTOS";"2452";FALSE;"2006-2021";4
2020;"OPERADORES DE INSTALACOES E EQUIPAMENTOS DE FABRICACAO DE CERAMICAS, VIDROS E PORCELANAS";"2452";FALSE;"2006-2021";2
2020;"OPERADORES DE INSTALACOES E EQUIPAMENTOS DE FABRICACAO DE MATERIAIS DE CONSTRUCAO";"2452";FALSE;"2006-2021";2
2020;"OPERADORES DE INSTALACOES E MAQUINAS DE PRODUTOS PLASTICOS, DE BORRACHA E PARAFINAS";"2452";FALSE;"2006-2021";19
2020;"OPERADORES DE LAMINACAO";"2452";FALSE;"2006-2021";46
2020;"OPERADORES DE MAQUINAS A VAPOR E UTILIDADES";"2452";FALSE;"2006-2021";111
2020;"OPERADORES DE MAQUINAS DE CONFORMACAO DE METAIS";"2452";FALSE;"2006-2021";35
2020;"OPERADORES DE MAQUINAS DE DESDOBRAMENTO DE MADEIRAS";"2452";FALSE;"2006-2021";2
2020;"OPERADORES DE MAQUINAS DE FABRICAR PAPEL E PAPELAO";"2452";FALSE;"2006-2021";2
2020;"OPERADORES DE MAQUINAS DE USINAGEM DE MADEIRA CNC";"2452";FALSE;"2006-2021";1
2020;"OPERADORES DE MAQUINAS E CENTROS DE USINAGEM CNC";"2452";FALSE;"2006-2021";367
2020;"OPERADORES DE MAQUINAS E EQUIPAMENTOS DE ELEVACAO";"2452";FALSE;"2006-2021";9
2020;"OPERADORES DE MOAGEM E MISTURA DE MATERIAIS (TRATAMENTOS QUIMICOS E AFINS)";"2452";FALSE;"2006-2021";5
2020;"OPERADORES DE PROCESSO TERMOQUIMICOS E AFINS";"2452";FALSE;"2006-2021";6
2020;"OPERADORES DE PROCESSOS DAS INDUSTRIAS DE TRANSFORMACAO DE PRODUTOS QUIMICOS, PETROQUIMICOS E AFINS";"2452";FALSE;"2006-2021";2
2020;"OUTROS TRABALHADORES DOS SERVICOS";"2452";FALSE;"2006-2021";5
2020;"Outras Ocupações";"2452";FALSE;"2006-2021";74
2020;"PESQUISADORES DE ENGENHARIA E TECNOLOGIA";"2452";FALSE;"2006-2021";5
2020;"PINTORES DE OBRAS E REVESTIDORES DE INTERIORES (REVESTIMENTOS FLEXIVEIS)";"2452";FALSE;"2006-2021";8
2020;"PORTEIROS, GUARDAS E VIGIAS";"2452";FALSE;"2006-2021";90
2020;"PREPARADORES E OPERADORES DE MAQUINAS-FERRAMENTA CONVENCIONAIS";"2452";FALSE;"2006-2021";562
2020;"PREPARADORES E OPERADORES DE USINAGEM DE MADEIRA CONVENCIONAL";"2452";FALSE;"2006-2021";12
2020;"PROFISSIONAIS DA INFORMACAO";"2452";FALSE;"2006-2021";0
2020;"PROFISSIONAIS DA METROLOGIA";"2452";FALSE;"2006-2021";0
2020;"PROFISSIONAIS DE ADMINISTRACAO ECONOMICO-FINANCEIRA";"2452";FALSE;"2006-2021";13
2020;"PROFISSIONAIS DE PLANEJAMENTO, PROGRAMACAO E CONTROLES LOGISTICOS";"2452";FALSE;"2006-2021";3
2020;"PROFISSIONAIS DE RECURSOS HUMANOS";"2452";FALSE;"2006-2021";22
2020;"PROFISSIONAIS DE RELACOES PUBLICAS, PUBLICIDADE, MERCADO E NEGOCIOS";"2452";FALSE;"2006-2021";5
2020;"PROFISSIONAIS EM PESQUISA E ANALISE ECONOMICAS";"2452";FALSE;"2006-2021";7
2020;"QUIMICOS";"2452";FALSE;"2006-2021";6
2020;"RECEPCIONISTAS";"2452";FALSE;"2006-2021";23
2020;"SECRETARIOS EXECUTIVOS E BILINGUES";"2452";FALSE;"2006-2021";9
2020;"SOPRADORES, MOLDADORES E MODELADORES DE VIDROS E AFINS";"2452";FALSE;"2006-2021";3
2020;"SUPERVISORES DA CONSTRUCAO CIVIL";"2452";FALSE;"2006-2021";3
2020;"SUPERVISORES DA EXTRACAO MINERAL";"2452";FALSE;"2006-2021";1
2020;"SUPERVISORES DA INDUSTRIA TEXTIL";"2452";FALSE;"2006-2021";11
2020;"SUPERVISORES DA MECANICA DE PRECISAO E INSTRUMENTOS MUSICAIS";"2452";FALSE;"2006-2021";0
2020;"SUPERVISORES DA MONTAGEM METALMECANICA";"2452";FALSE;"2006-2021";6
2020;"SUPERVISORES DA PRODUCAO DE UTILIDADES";"2452";FALSE;"2006-2021";2
2020;"SUPERVISORES DAS ARTES GRAFICAS";"2452";FALSE;"2006-2021";0
2020;"SUPERVISORES DE MANUTENCAO ELETRO-ELETRONICA INDUSTRIAL, COMERCIAL E RESIDENCIAL";"2452";FALSE;"2006-2021";4
2020;"SUPERVISORES DE MANUTENCAO ELETROMECANICA";"2452";FALSE;"2006-2021";3
2020;"SUPERVISORES DE MONTAGENS E INSTALACOES ELETROELETRONICAS";"2452";FALSE;"2006-2021";9
2020;"SUPERVISORES DE PRODUCAO EM INDUSTRIAS SIDERURGICAS";"2452";FALSE;"2006-2021";13
2020;"SUPERVISORES DE SERVICOS ADMINISTRATIVOS (EXCETO CONTABILIDADE, FINANCAS E CONTROLE)";"2452";FALSE;"2006-2021";35
2020;"SUPERVISORES DE SERVICOS FINANCEIROS, DE CAMBIO E DE CONTROLE";"2452";FALSE;"2006-2021";16
2020;"SUPERVISORES DE TRABALHADORES DE ATENDIMENTO AO PUBLICO";"2452";FALSE;"2006-2021";3
2020;"SUPERVISORES DE TRABALHADORES DE EMBALAGEM E ETIQUETAGEM";"2452";FALSE;"2006-2021";3
2020;"SUPERVISORES DE USINAGEM, CONFORMACAO E TRATAMENTO DE METAIS";"2452";FALSE;"2006-2021";159
2020;"SUPERVISORES DE VENDAS E DE PRESTACAO DE SERVICOS";"2452";FALSE;"2006-2021";12
2020;"SUPERVISORES DE VIDRARIA, CERAMICA E AFINS";"2452";FALSE;"2006-2021";4
2020;"SUPERVISORES DOS SERVICOS DE PROTECAO, SEGURANCA E OUTROS";"2452";FALSE;"2006-2021";1
2020;"SUPERVISORES EM SERVICOS DE REPARACAO E MANUTENCAO DE MAQUINAS E EQUIPAMENTOS INDUSTRIAIS, COMERCIAIS E RESIDENCIAIS";"2452";FALSE;"2006-2021";33
2020;"SUPERVISORES NA FABRICACAO DE MATERIAIS PARA CONSTRUCAO (VIDROS E CERAMICAS)";"2452";FALSE;"2006-2021";0
2020;"TECNICOS DE APOIO EM PESQUISA E DESENVOLVIMENTO";"2452";FALSE;"2006-2021";3
2020;"TECNICOS DE CONTROLE DA PRODUCAO";"2452";FALSE;"2006-2021";373
2020;"TECNICOS DE LABORATORIO INDUSTRIAL";"2452";FALSE;"2006-2021";53
2020;"TECNICOS DE PLANEJAMENTO E CONTROLE DE PRODUCAO";"2452";FALSE;"2006-2021";143
2020;"TECNICOS DE VENDAS ESPECIALIZADAS";"2452";FALSE;"2006-2021";38
2020;"TECNICOS E AUXILIARES DE ENFERMAGEM";"2452";FALSE;"2006-2021";6
2020;"TECNICOS EM CALIBRACAO E INSTRUMENTACAO";"2452";FALSE;"2006-2021";3
2020;"TECNICOS EM CONSTRUCAO CIVIL (EDIFICACOES)";"2452";FALSE;"2006-2021";0
2020;"TECNICOS EM CONTABILIDADE";"2452";FALSE;"2006-2021";5
2020;"TECNICOS EM CONTROLE AMBIENTAL, UTILIDADES E TRATAMENTO DE EFLUENTES";"2452";FALSE;"2006-2021";4
2020;"TECNICOS EM ELETRICIDADE E ELETROTECNICOS (COVALIDACAO 3131)";"2452";FALSE;"2006-2021";31
2020;"TECNICOS EM ELETROMECANICA";"2452";FALSE;"2006-2021";16
2020;"TECNICOS EM ELETRONICA";"2452";FALSE;"2006-2021";48
2020;"TECNICOS EM EQUIPAMENTOS MEDICOS E ODONTOLOGICOS";"2452";FALSE;"2006-2021";1
2020;"TECNICOS EM EXPORTACAO E IMPORTACAO";"2452";FALSE;"2006-2021";1
2020;"TECNICOS EM MECATRONICA";"2452";FALSE;"2006-2021";9
2020;"TECNICOS EM METALURGIA (ESTRUTURAS METALICAS)";"2452";FALSE;"2006-2021";2
2020;"TECNICOS EM OPERACAO DE APARELHOS DE CENOGRAF";"2452";FALSE;"2006-2021";6
2020;"TECNICOS EM OPERACAO DE APARELHOS DE SONORIZACAO";"2452";FALSE;"2006-2021";0
2020;"TECNICOS EM OPERACAO E MONITORACAO DE COMPUTADORES";"2452";FALSE;"2006-2021";5
2020;"TECNICOS EM PROGRAMACAO";"2452";FALSE;"2006-2021";15
2020;"TECNICOS EM SECRETARIADO, TAQUIGRAFOS E ESTENOTIPISTAS";"2452";FALSE;"2006-2021";4
2020;"TECNICOS EM SEGURANCA NO TRABALHO";"2452";FALSE;"2006-2021";43
2020;"TECNICOS EM SIDERURGIA";"2452";FALSE;"2006-2021";19
2020;"TECNICOS EM TRANSPORTES INTERMODAIS";"2452";FALSE;"2006-2021";13
2020;"TECNICOS EM TRANSPORTES RODOVIARIOS";"2452";FALSE;"2006-2021";9
2020;"TECNICOS MECANICOS (FERRAMENTAS)";"2452";FALSE;"2006-2021";23
2020;"TECNICOS MECANICOS NA FABRICACAO E MONTAGEM DE MAQUINAS, SISTEMAS E INSTRUMENTOS";"2452";FALSE;"2006-2021";49
2020;"TECNICOS MECANICOS NA MANUTENCAO DE MAQUINAS, SISTEMAS E INSTRUMENTOS";"2452";FALSE;"2006-2021";6
2020;"TECNICOS QUIMICOS";"2452";FALSE;"2006-2021";12
2020;"TELEFONISTAS";"2452";FALSE;"2006-2021";1
2020;"TINTUREIROS, LAVADEIROS E AFINS, À MAQUINA";"2452";FALSE;"2006-2021";0
2020;"TRABALHADORES AUXILIARES NOS SERVICOS DE ALIMENTACAO";"2452";FALSE;"2006-2021";7
2020;"TRABALHADORES DA EXTRACAO DE MINERAIS SOLIDOS";"2452";FALSE;"2006-2021";0
2020;"TRABALHADORES DA IMPRESSAO GRAFICA";"2452";FALSE;"2006-2021";6
2020;"TRABALHADORES DA MECANIZACAO AGROPECUARIA";"2452";FALSE;"2006-2021";16
2020;"TRABALHADORES DA PINTURA DE EQUIPAMENTOS, VEICULOS, ESTRUTURAS METALICAS E DE COMPOSITOS";"2452";FALSE;"2006-2021";32
2020;"TRABALHADORES DA PRE-IMPRESSAO GRAFICA";"2452";FALSE;"2006-2021";5
2020;"TRABALHADORES DA PREPARACAO DA CONFECCAO DE CALCADOS";"2452";FALSE;"2006-2021";1
2020;"TRABALHADORES DA PREPARACAO DA CONFECCAO DE ROUPAS";"2452";FALSE;"2006-2021";8
2020;"TRABALHADORES DA TRANSFORMACAO DE VIDROS PLANOS";"2452";FALSE;"2006-2021";1
2020;"TRABALHADORES DE ACABAMENTO, TINGIMENTO E ESTAMPARIA DAS INDUSTRIAS TEXTEIS";"2452";FALSE;"2006-2021";0
2020;"TRABALHADORES DE APOIO À AGRICULTURA";"2452";FALSE;"2006-2021";16
2020;"TRABALHADORES DE BENEFICIAMENTO DE MINERIOS";"2452";FALSE;"2006-2021";18
2020;"TRABALHADORES DE BENEFICIAMENTO DE PEDRAS ORNAMENTAIS";"2452";FALSE;"2006-2021";3
2020;"TRABALHADORES DE CALDEIRARIA E SERRALHERIA";"2452";FALSE;"2006-2021";48
2020;"TRABALHADORES DE CARGAS E DESCARGAS DE MERCADORIAS";"2452";FALSE;"2006-2021";22
2020;"TRABALHADORES DE EMBALAGEM E DE ETIQUETAGEM";"2452";FALSE;"2006-2021";94
2020;"TRABALHADORES DE ESTRUTURAS DE ALVENARIA";"2452";FALSE;"2006-2021";22
2020;"TRABALHADORES DE EXTRACAO DE MINERAIS SOLIDOS (OPERADORES DE MAQUINAS)";"2452";FALSE;"2006-2021";8
2020;"TRABALHADORES DE FORJAMENTO DE METAIS";"2452";FALSE;"2006-2021";8
2020;"TRABALHADORES DE FUNDICAO DE METAIS PUROS E DE LIGAS METALICAS";"2452";FALSE;"2006-2021";1504
2020;"TRABALHADORES DE INSTALACOES DE MATERIAIS ISOLANTES";"2452";FALSE;"2006-2021";0
2020;"TRABALHADORES DE INSTALACOES ELETRICAS";"2452";FALSE;"2006-2021";14
2020;"TRABALHADORES DE MANUTENCAO DE ROCADEIRAS, MOTOSERRAS E SIMILARES";"2452";FALSE;"2006-2021";0
2020;"TRABALHADORES DE MOLDAGEM DE METAIS E DE LIGAS METALICAS";"2452";FALSE;"2006-2021";565
2020;"TRABALHADORES DE MONTAGEM DE ESTRUTURAS DE MADEIRA, METAL E COMPOSITOS EM OBRAS CIVIS";"2452";FALSE;"2006-2021";3
2020;"TRABALHADORES DE SOLDAGEM E CORTE DE METAIS E DE COMPOSITOS";"2452";FALSE;"2006-2021";167
2020;"TRABALHADORES DE TRACAGEM E MONTAGEM DE ESTRUTURAS METALICAS E DE COMPOSITOS";"2452";FALSE;"2006-2021";51
2020;"TRABALHADORES DE TRATAMENTO DE SUPERFICIES DE METAIS E DE COMPOSITOS (TERMOQUIMICOS)";"2452";FALSE;"2006-2021";31
2020;"TRABALHADORES DE TRATAMENTO TERMICO DE METAIS E DE COMPOSITOS";"2452";FALSE;"2006-2021";12
2020;"TRABALHADORES DE TREFILACAO, ESTIRAMENTO E EXTRUSAO DE METAIS E DE COMPOSITOS";"2452";FALSE;"2006-2021";1
2020;"TRABALHADORES DO ACABAMENTO GRAFICO";"2452";FALSE;"2006-2021";1
2020;"TRABALHADORES DOS SERVICOS DOMESTICOS EM GERAL";"2452";FALSE;"2006-2021";42
2020;"TRABALHADORES ELEMENTARES DE SERVICOS DE MANUTENCAO VEICULAR";"2452";FALSE;"2006-2021";5
2020;"TRABALHADORES NA FABRICACAO E CONSERVACAO DE ALIMENTOS";"2452";FALSE;"2006-2021";0
2020;"TRABALHADORES NA OPERACAO DE MAQUINAS DE TERRAPLENAGEM E FUNDACOES";"2452";FALSE;"2006-2021";26
2020;"TRABALHADORES NOS  SERVICOS DE MANUTENCAO DE EDIFICACOES";"2452";FALSE;"2006-2021";184
2020;"TRABALHADORES NOS SERVICOS DE ADMINISTRACAO DE EDIFICIOS";"2452";FALSE;"2006-2021";6
2020;"TRABALHADORES NOS SERVICOS DE MANUTENCAO E CONSERVACAO DE EDIFICIOS E LOGRADOUROS";"2452";FALSE;"2006-2021";6
2020;"TRABALHADORES OPERACIONAIS DE CONSERVACAO DE VIAS PERMANENTES (EXCETO TRILHOS)";"2452";FALSE;"2006-2021";1
2020;"TRABALHADORES POLIVALENTES DA CONFECCAO DE CALCADOS";"2452";FALSE;"2006-2021";0
2020;"Total";"2452";TRUE;"2006-2021";11238
2020;"VENDEDORES E DEMONSTRADORES EM LOJAS OU MERCADOS";"2452";FALSE;"2006-2021";78
2020;"VENDEDORES EM DOMICILIO";"2452";FALSE;"2006-2021";2
2020;"VIGILANTES E GUARDAS DE SEGURANCA";"2452";FALSE;"2006-2021";9
2021;"ADMINISTRADORES DE EMPRESAS";"2452";FALSE;"2006-2021";33
2021;"ADVOGADOS";"2452";FALSE;"2006-2021";2
2021;"AFIADORES E POLIDORES DE METAIS";"2452";FALSE;"2006-2021";155
2021;"AGENTES DA SAUDE E DO MEIO AMBIENTE";"2452";FALSE;"2006-2021";2
2021;"AGENTES DE INSPECAO DE PESOS E MEDIDAS";"2452";FALSE;"2006-2021";12
2021;"AJUDANTES DE OBRAS CIVIS";"2452";FALSE;"2006-2021";29
2021;"AJUSTADORES MECANICOS POLIVALENTES";"2452";FALSE;"2006-2021";45
2021;"ALIMENTADORES DE LINHAS DE PRODUCAO";"2452";FALSE;"2006-2021";2038
2021;"ALMOXARIFES E ARMAZENISTAS";"2452";FALSE;"2006-2021";234
2021;"ANALISTAS DE SISTEMAS COMPUTACIONAIS";"2452";FALSE;"2006-2021";23
2021;"ARTESAOS DE METAIS PRECIOSOS E SEMI-PRECIOSOS";"2452";FALSE;"2006-2021";20
2021;"AUXILIARES DE LABORATORIO DA SAUDE";"2452";FALSE;"2006-2021";2
2021;"BOMBEIROS E SALVA-VIDAS";"2452";FALSE;"2006-2021";0
2021;"CAIXAS E BILHETEIROS (EXCETO CAIXA DE BANCO)";"2452";FALSE;"2006-2021";1
2021;"CARVOEJADORES E AFINS";"2452";FALSE;"2006-2021";0
2021;"CATADORES DE SUCATA";"2452";FALSE;"2006-2021";28
2021;"CERAMISTAS (PREPARACAO E FABRICACAO)";"2452";FALSE;"2006-2021";0
2021;"COBRADORES E AFINS";"2452";FALSE;"2006-2021";1
2021;"COLORISTAS";"2452";FALSE;"2006-2021";2
2021;"COMPRADORES";"2452";FALSE;"2006-2021";48
2021;"CONSERVADORES DE VIAS PERMANENTES (TRILHOS)";"2452";FALSE;"2006-2021";3
2021;"CONTADORES E AUDITORES";"2452";FALSE;"2006-2021";34
2021;"CONTINUOS";"2452";FALSE;"2006-2021";7
2021;"COZINHEIROS";"2452";FALSE;"2006-2021";12
2021;"DESENHISTAS INDUSTRIAIS (DESIGNERS) , ESCULTORES, PINTORES E AFINS";"2452";FALSE;"2006-2021";5
2021;"DESENHISTAS PROJETISTAS DA MECANICA";"2452";FALSE;"2006-2021";23
2021;"DESENHISTAS TECNICOS DA MECANICA";"2452";FALSE;"2006-2021";3
2021;"DESENHISTAS TECNICOS DE PRODUTOS E SERVICOS DIVERSOS";"2452";FALSE;"2006-2021";6
2021;"DESENHISTAS TECNICOS, EM GERAL";"2452";FALSE;"2006-2021";6
2021;"DIRETORES ADMINISTRATIVOS E FINANCEIROS";"2452";FALSE;"2006-2021";5
2021;"DIRETORES DE MARKETING, COMERCIALIZACAO E VENDAS";"2452";FALSE;"2006-2021";3
2021;"DIRETORES DE PRODUCAO E OPERACOES EM EMPRESA DA INDUSTRIA EXTRATIVA, TRANSFORMACAO E DE SERVICOS DE UTILIDADE PUBLICA";"2452";FALSE;"2006-2021";0
2021;"DIRETORES GERAIS";"2452";FALSE;"2006-2021";6
2021;"ELETRICISTAS-ELETRONICOS DE MANUTENCAO";"2452";FALSE;"2006-2021";51
2021;"ELETRICISTAS-ELETRONICOS DE MANUTENCAO VEICULAR (AEREA, TERRESTRE E NAVAL)";"2452";FALSE;"2006-2021";3
2021;"ENCANADORES E INSTALADORES DE TUBULACOES";"2452";FALSE;"2006-2021";0
2021;"ENFERMEIROS DE NIVEL SUPERIOR E AFINS";"2452";FALSE;"2006-2021";0
2021;"ENGENHEIROS AMBIENTAIS E AFINS";"2452";FALSE;"2006-2021";1
2021;"ENGENHEIROS CIVIS E AFINS";"2452";FALSE;"2006-2021";2
2021;"ENGENHEIROS ELETROELETRONICOS E AFINS";"2452";FALSE;"2006-2021";1
2021;"ENGENHEIROS INDUSTRIAIS, DE PRODUCAO E SEGURANCA";"2452";FALSE;"2006-2021";29
2021;"ENGENHEIROS MECANICOS";"2452";FALSE;"2006-2021";5
2021;"ENGENHEIROS METALURGISTAS E DE MATERIAIS";"2452";FALSE;"2006-2021";5
2021;"ENGENHEIROS QUIMICOS";"2452";FALSE;"2006-2021";1
2021;"ESCRITURARIOS DE APOIO À PRODUCAO";"2452";FALSE;"2006-2021";108
2021;"ESCRITURARIOS DE CONTABILIDADE";"2452";FALSE;"2006-2021";72
2021;"ESCRITURARIOS EM GERAL, AGENTES, ASSISTENTES E AUXILIARES ADMINISTRATIVOS";"2452";FALSE;"2006-2021";495
2021;"ESPECIALISTAS EM INFORMATICA";"2452";FALSE;"2006-2021";3
2021;"FERRAMENTEIROS E AFINS";"2452";FALSE;"2006-2021";324
2021;"FISCAIS E COBRADORES DOS TRANSPORTES PUBLICOS";"2452";FALSE;"2006-2021";1
2021;"FORNEIROS METALURGICOS (SEGUNDA FUSAO E REAQUECIMENTO)";"2452";FALSE;"2006-2021";219
2021;"GARCONS, BARMEN, COPEIROS E SOMMELIERS";"2452";FALSE;"2006-2021";6
2021;"GERENTES ADMINISTRATIVOS, FINANCEIROS E DE RISCOS";"2452";FALSE;"2006-2021";58
2021;"GERENTES DE MANUTENCAO";"2452";FALSE;"2006-2021";11
2021;"GERENTES DE MARKETING, COMERCIALIZACAO E VENDAS";"2452";FALSE;"2006-2021";43
2021;"GERENTES DE OPERACOES COMERCIAIS E DE REPARACAO";"2452";FALSE;"2006-2021";13
2021;"GERENTES DE OPERACOES DE SERVICOS EM EMPRESA DE TRANSPORTE, DE COMUNICACAO E DE LOGISTICA (ARMAZENAGEM E DISTRIBUICAO)";"2452";FALSE;"2006-2021";6
2021;"GERENTES DE PESQUISA E DESENVOLVIMENTO";"2452";FALSE;"2006-2021";7
2021;"GERENTES DE PRODUCAO E OPERACOES EM EMPRESA DA INDUSTRIA EXTRATIVA, DE TRANSFORMACAO E DE SERVICOS DE UTILIDADE PUBLICA";"2452";FALSE;"2006-2021";85
2021;"GERENTES DE RH E RELACOES DO TRABALHO";"2452";FALSE;"2006-2021";11
2021;"GERENTES DE SUPRIMENTOS E AFINS";"2452";FALSE;"2006-2021";12
2021;"GERENTES DE TECNOLOGIA DA INFORMACAO";"2452";FALSE;"2006-2021";2
2021;"INSTALADORES E REPARADORES DE LINHAS E CABOS ELETRICOS, TELEFONICOS E DE COMUNICACAO DE DADOS";"2452";FALSE;"2006-2021";1
2021;"INSTRUTORES DE ENSINO PROFISSIONAL";"2452";FALSE;"2006-2021";2
2021;"LABORATORISTAS INDUSTRIAIS AUXILIARES";"2452";FALSE;"2006-2021";17
2021;"LUBRIFICADORES";"2452";FALSE;"2006-2021";7
2021;"MANTENEDORES DE ELVADORES, ESCADAS E PORTAS AUTOMATICAS";"2452";FALSE;"2006-2021";10
2021;"MARCENEIROS E AFINS";"2452";FALSE;"2006-2021";6
2021;"MECANICOS DE INSTRUMENTOS DE PRECISAO (EXCETO TECNICOS)";"2452";FALSE;"2006-2021";79
2021;"MECANICOS DE MANUTENCAO DE BOMBAS, MOTORES, COMPRESSORES E EQUIPAMENTOS DE TRANSMISSAO";"2452";FALSE;"2006-2021";0
2021;"MECANICOS DE MANUTENCAO DE MAQUINAS INDUSTRIAIS";"2452";FALSE;"2006-2021";206
2021;"MECANICOS DE MANUTENCAO DE MAQUINAS PESADAS E EQUIPAMENTOS AGRICOLAS";"2452";FALSE;"2006-2021";1
2021;"MECANICOS DE MANUTENCAO DE VEICULOS AUTOMOTORES";"2452";FALSE;"2006-2021";16
2021;"MEDICOS CLINICOS";"2452";FALSE;"2006-2021";6
2021;"MONTADORES DE EQUIPAMENTOS ELETRO-ELETRONICOS";"2452";FALSE;"2006-2021";5
2021;"MONTADORES DE ESTRUTURAS DE CONCRETO ARMADO";"2452";FALSE;"2006-2021";1
2021;"MONTADORES DE MAQUINAS INDUSTRIAIS";"2452";FALSE;"2006-2021";35
2021;"MONTADORES DE MAQUINAS PESADAS E EQUIPAMENTOS AGRICOLAS";"2452";FALSE;"2006-2021";0
2021;"MONTADORES DE MAQUINAS, APARELHOS E ACESSORIOS EM LINHAS DE MONTAGEM";"2452";FALSE;"2006-2021";13
2021;"MONTADORES DE MOVEIS E ARTEFATOS DE MADEIRA";"2452";FALSE;"2006-2021";1
2021;"MOTOCICLISTAS E CICLISTAS DE ENTREGAS RAPIDAS";"2452";FALSE;"2006-2021";3
2021;"MOTORISTAS DE VEICULOS DE CARGAS EM GERAL";"2452";FALSE;"2006-2021";77
2021;"MOTORISTAS DE VEICULOS DE PEQUENO E MEDIO PORTE";"2452";FALSE;"2006-2021";67
2021;"OPERADORES DA FIACAO";"2452";FALSE;"2006-2021";2
2021;"OPERADORES DE EQUIPAMENTOS DE ACABAMENTO DE CHAPAS E METAIS";"2452";FALSE;"2006-2021";709
2021;"OPERADORES DE EQUIPAMENTOS DE COQUEIFICACAO";"2452";FALSE;"2006-2021";15
2021;"OPERADORES DE EQUIPAMENTOS DE MOVIMENTACAO DE CARGAS";"2452";FALSE;"2006-2021";198
2021;"OPERADORES DE FILTRAGEM E SEPARACAO";"2452";FALSE;"2006-2021";6
2021;"OPERADORES DE FORNOS DE PRIMEIRA  FUSAO E ACIARIA";"2452";FALSE;"2006-2021";458
2021;"OPERADORES DE INSTALACOES DE CAPTACAO E TRATAMENTO DE ESGOTOS";"2452";FALSE;"2006-2021";3
2021;"OPERADORES DE INSTALACOES E EQUIPAMENTOS DE FABRICACAO DE CERAMICAS, VIDROS E PORCELANAS";"2452";FALSE;"2006-2021";2
2021;"OPERADORES DE INSTALACOES E EQUIPAMENTOS DE FABRICACAO DE MATERIAIS DE CONSTRUCAO";"2452";FALSE;"2006-2021";1
2021;"OPERADORES DE INSTALACOES E MAQUINAS DE PRODUTOS PLASTICOS, DE BORRACHA E PARAFINAS";"2452";FALSE;"2006-2021";16
2021;"OPERADORES DE LAMINACAO";"2452";FALSE;"2006-2021";48
2021;"OPERADORES DE MAQUINAS A VAPOR E UTILIDADES";"2452";FALSE;"2006-2021";124
2021;"OPERADORES DE MAQUINAS DE CONFORMACAO DE METAIS";"2452";FALSE;"2006-2021";53
2021;"OPERADORES DE MAQUINAS DE DESDOBRAMENTO DE MADEIRAS";"2452";FALSE;"2006-2021";3
2021;"OPERADORES DE MAQUINAS DE FABRICAR PAPEL E PAPELAO";"2452";FALSE;"2006-2021";1
2021;"OPERADORES DE MAQUINAS DE USINAGEM DE MADEIRA CNC";"2452";FALSE;"2006-2021";0
2021;"OPERADORES DE MAQUINAS E CENTROS DE USINAGEM CNC";"2452";FALSE;"2006-2021";285
2021;"OPERADORES DE MAQUINAS E EQUIPAMENTOS DE ELEVACAO";"2452";FALSE;"2006-2021";9
2021;"OPERADORES DE MOAGEM E MISTURA DE MATERIAIS (TRATAMENTOS QUIMICOS E AFINS)";"2452";FALSE;"2006-2021";4
2021;"OPERADORES DE PROCESSO TERMOQUIMICOS E AFINS";"2452";FALSE;"2006-2021";8
2021;"OPERADORES DE PROCESSOS DAS INDUSTRIAS DE TRANSFORMACAO DE PRODUTOS QUIMICOS, PETROQUIMICOS E AFINS";"2452";FALSE;"2006-2021";5
2021;"OUTROS TRABALHADORES DOS SERVICOS";"2452";FALSE;"2006-2021";7
2021;"Outras Ocupações";"2452";FALSE;"2006-2021";58
2021;"PESQUISADORES DE ENGENHARIA E TECNOLOGIA";"2452";FALSE;"2006-2021";2
2021;"PINTORES DE OBRAS E REVESTIDORES DE INTERIORES (REVESTIMENTOS FLEXIVEIS)";"2452";FALSE;"2006-2021";9
2021;"PORTEIROS, GUARDAS E VIGIAS";"2452";FALSE;"2006-2021";82
2021;"PREPARADORES E OPERADORES DE MAQUINAS-FERRAMENTA CONVENCIONAIS";"2452";FALSE;"2006-2021";596
2021;"PREPARADORES E OPERADORES DE USINAGEM DE MADEIRA CONVENCIONAL";"2452";FALSE;"2006-2021";16
2021;"PROFISSIONAIS DA INFORMACAO";"2452";FALSE;"2006-2021";0
2021;"PROFISSIONAIS DA METROLOGIA";"2452";FALSE;"2006-2021";1
2021;"PROFISSIONAIS DE ADMINISTRACAO ECONOMICO-FINANCEIRA";"2452";FALSE;"2006-2021";17
2021;"PROFISSIONAIS DE PLANEJAMENTO, PROGRAMACAO E CONTROLES LOGISTICOS";"2452";FALSE;"2006-2021";5
2021;"PROFISSIONAIS DE RECURSOS HUMANOS";"2452";FALSE;"2006-2021";29
2021;"PROFISSIONAIS DE RELACOES PUBLICAS, PUBLICIDADE, MERCADO E NEGOCIOS";"2452";FALSE;"2006-2021";5
2021;"PROFISSIONAIS EM PESQUISA E ANALISE ECONOMICAS";"2452";FALSE;"2006-2021";11
2021;"QUIMICOS";"2452";FALSE;"2006-2021";5
2021;"RECEPCIONISTAS";"2452";FALSE;"2006-2021";22
2021;"SECRETARIOS EXECUTIVOS E BILINGUES";"2452";FALSE;"2006-2021";9
